{
  "annotated_by": "婉儿",
  "annotated_at": "2026-07-12T22:00:00+08:00",
  "reviewed_by": "大G",
  "reviewed_at": "2026-07-13T09:00:00+08:00",
  "disagreements": [
    {
      "target_id": "expected_dp_a_001",
      "raised_by": "大G",
      "description": "table DataPoint 的 source_quote 是跨 cell 拼接字符串，raw HTML 中不存在；quote_locator_hint 'table#metrics td' 匹配全部 4 个 cell 不够精确。建议在 M2-003B 的 FixtureProvider 中定义表格行 tokenization 策略。",
      "resolution": "ACCEPTED — 保留当前黄金标签并在 M2-003B 中实现表格行列 tokenization",
      "adjudication_note": "大黄：表格语义定位精度问题属于工程实现细节，黄金集只需用最佳努力 locator 标注预期内容位置。M2-003B 在 FixtureProvider 中解决。"
    },
    {
      "target_id": "expected_dp_a_002",
      "raised_by": "大G",
      "description": "同上 D-2，table DataPoint 定位精度问题。",
      "resolution": "ACCEPTED — 同上",
      "adjudication_note": "同 D-2，在 M2-003B 解决。"
    }
  ],
  "adjudication_note": "大黄裁决 D-002：采用 prediction 方案 A；D-001/D-003 同意大G建议。详见 docs/qa/M2-003A_disagreements.json。",
  "fixture_source_hash": "c5b1ddbacf5d92a7115e57e2e9271aeb215822c1f152eac7c03d4c3e0759afaa",
  "case_id": "case_a_web",
  "case_title": "中芯国际2025年度业绩摘要（网页）",
  "material_path": "tests/fixtures/m2_002/case_a_web.html",

  "expected_entities": [
    {
      "id": "expected_entity_a_001",
      "entity_type": "organization",
      "canonical_name": "中芯国际"
    }
  ],

  "expected_data_points": [
    {
      "id": "expected_dp_a_001",
      "metric": "营业收入",
      "value": 673.23,
      "unit": "亿元",
      "entity_id": "expected_entity_a_001",
      "period": "2025",
      "measurement_context": {
        "measurement_kind": "monetary",
        "currency": "CNY",
        "scale_multiplier": 100000000,
        "reporting_standard": "CAS",
        "attribution_scope": "group_total",
        "consolidation_scope": "consolidated"
      },
      "source_quote": "营业收入 673.23亿元",
      "quote_locator_hint": "table#metrics td"
    },
    {
      "id": "expected_dp_a_002",
      "metric": "产能利用率",
      "value": 93.5,
      "unit": "percent",
      "entity_id": "expected_entity_a_001",
      "period": "2025",
      "measurement_context": {
        "measurement_kind": "percentage",
        "currency": null,
        "scale_multiplier": 1,
        "reporting_standard": null,
        "attribution_scope": "group_total",
        "consolidation_scope": "consolidated"
      },
      "source_quote": "产能利用率 93.5%",
      "quote_locator_hint": "table#metrics td"
    }
  ],

  "expected_claims": [
    {
      "id": "expected_cl_a_001",
      "statement": "公司2025年营业收入保持增长",
      "claim_type": "fact_claim",
      "claim_dimension": "business_growth",
      "claimant_id": "expected_entity_a_001",
      "source_quote": "公司2025年营业收入保持增长",
      "quote_locator_hint": "article p"
    },
    {
      "id": "expected_cl_a_002",
      "statement": "产能利用率维持较高水平",
      "claim_type": "fact_claim",
      "claim_dimension": "operations",
      "claimant_id": "expected_entity_a_001",
      "source_quote": "产能利用率维持较高水平",
      "quote_locator_hint": "article p"
    },
    {
      "id": "expected_cl_a_003",
      "statement": "公司将继续推进产能建设",
      "claim_type": "prediction",
      "claim_dimension": "business_growth",
      "claimant_id": "expected_entity_a_001",
      "asserted_by": "中芯国际管理层",
      "time_horizon": {
        "start": null,
        "end": null,
        "precision": "unknown"
      },
      "promotable_to_fact": false,
      "source_quote": "管理层表示将继续推进产能建设。",
      "quote_locator_hint": "blockquote"
    }
  ],

  "expected_evidence": [
    {
      "id": "expected_ev_a_001",
      "evidence_type": "company_filing",
      "evidence_role": "support",
      "target_object_id": "expected_dp_a_001",
      "independence_group": "smics_annual_report_2025",
      "source_quote": "营业收入 673.23亿元",
      "note": "来源于中芯国际官方年度披露（年报）。Case A 网页是年报披露的摘要版本。"
    },
    {
      "id": "expected_ev_a_002",
      "evidence_type": "company_filing",
      "evidence_role": "support",
      "target_object_id": "expected_dp_a_002",
      "independence_group": "smics_annual_report_2025",
      "source_quote": "产能利用率 93.5%",
      "note": "与 evidence_a_001 属于同一 independence_group（同一份年报），独立计数时只计 1"
    }
  ],

  "expected_fact_candidates": [
    {
      "id": "expected_fc_a_001",
      "target_data_point_id": "expected_dp_a_001",
      "supporting_evidence_ids": ["expected_ev_a_001"],
      "statement": "中芯国际2025年度营业收入为673.23亿元",
      "valid_time": {"period": "2025"},
      "confidence_rationale": "官方年报披露数据，原文表格可直接印证",
      "promotable": true
    }
  ],

  "expected_warnings": [
    {
      "id": "expected_warn_a_001",
      "target_id": "expected_cl_a_003",
      "warning_type": "CLAIM_SOFT_PREDICTION",
      "note": "管理层声明'将继续推进'被建模为 prediction。若后续系统支持双层 Claim，建议拆分为 Speech-act fact_claim + Embedded prediction。当前版本 prediction 缺少明确时间范围，precision=unknown，建议在未来版本补充。"
    }
  ],

  "expected_rejects": [
    {
      "id": "expected_rej_a_001",
      "rejection_reason": "CONTENT_UNIT_CODE_BLOCK_NON_CLAIM",
      "target_quote": "source = \"annual_report\"",
      "quote_locator_hint": "pre code",
      "note": "代码示例不是涉及公司经营的事实主张。预期行为：CONTENT_UNIT_TYPE 检测到代码块，跳过文本提取或标记为 INFO 级别警告。"
    }
  ],

  "validation_report": {
    "claim_type_coverage": "SUFFICIENT",
    "claim_dimension_coverage": "SUFFICIENT",
    "measurement_context_coverage": "SUFFICIENT",
    "quote_gate_executable": true,
    "fact_promotion_rules_sufficient": true,
    "review_bundle_usable": true,
    "core_schema_change_needed": false,
    "new_core_object_needed": false,
    "notes": "Case A Revision 1: D-001 代码块→expected_rejects; D-002 prediction方案A; D-003 independence_group→smics_annual_report_2025。涵盖 monetary 和 percentage 两种 MeasurementKind，prediction 新增 time_horizon 字段。表格定位精度问题待 M2-003B 解决。"
  }
}
